title,author,description,price,stock
The Ballad of Songbirds and Snakes,Suzanne Collins,Ambition will fuel him. Competition will drive him. But power has its price.,22,1
The Hunger Games,Suzanne Collins,A brutal and vicious read about a competition where there can only be one survivor.,21,3
Catching Fire,Suzanne Collins,There are rumors of rebellion among the subjects. Katniss and Peeta are the faces of that rebellion.,18,5
Mockingjay,Suzanne Collins,There are rebels. There are new leaders. A revolution is unfolding.,18,6
Alice in Wonderland,Lewis Carroll,An ordinary young girl craving for adventure discovers a wonderland in her dreams.,40,4
Alice in Wonderland and Through the Looking Glass,Lewis Carroll,Adventure continues for young Alice after she climbs through the mirror hanging above her fireplace's mantel.,17,2